<?xml version="1.0" encoding="utf-8"?>
<!-- 
Comment
-->
<Library
	xmlns:xsi="http://www.w3.org/2001/XMLSchema-instance"
	xsi:schemaLocation="temp.xsd">

	<Game>
		<TITLE> Boulder Dash </TITLE>
		<DEVELOPER> First Star Software  </DEVELOPER>
		<GENRE> Puzzle </GENRE>
		<YEAR> 1984 </YEAR>
		<COMPATIBILITY> Yes </COMPATIBILITY>
		<ISSUES> Slight jittering on vertical scrolling </ISSUES>
	</Game>


</Library>